{
  "signal_id": "phenology.first_of_season.hummingbird_spring",
  "signal_type": "phenology.first_of_season",
  "subject_taxa": [
    "Trochilidae"
  ],
  "subject_canonical": "hummingbird_any",
  "vocabulary": [
    "first hummingbird",
    "hummers are back",
    "anyone seeing any yet",
    "ruby throated arrived",
    "first hummer of the year",
    "put the feeders out",
    "hummingbird at the feeder"
  ],
  "anchor_feeds": [
    "journey-north:hummingbird-spring",
    "ebird:Trochilidae",
    "inaturalist:taxon-7227"
  ],
  "geography_resolution": "county",
  "season_window": {
    "month_start": 2,
    "month_end": 6
  },
  "baseline_period_years": 5,
  "trigger_logic": {
    "early": "first observation week N < baseline mean − 1.5 stddev",
    "late": "first observation week N > baseline mean + 1.5 stddev",
    "spike": "weekly post count > rolling 8-week mean × 3"
  },
  "active": true,
  "owner": "architect-curated"
}